{
  "$schema": "../../schema/0.1/vocabulary.schema.json",
  "id": "ten-point",
  "title": "Ten-point numeric grade",
  "description": "Numeric grades used by several card grading companies (1-10, half points allowed). Pair with 'grader' to say whose scale.",
  "license": "CC0-1.0",
  "ordered": true,
  "terms": [
    {
      "id": "10",
      "label": "10"
    },
    {
      "id": "9.5",
      "label": "9.5"
    },
    {
      "id": "9",
      "label": "9"
    },
    {
      "id": "8.5",
      "label": "8.5"
    },
    {
      "id": "8",
      "label": "8"
    },
    {
      "id": "7.5",
      "label": "7.5"
    },
    {
      "id": "7",
      "label": "7"
    },
    {
      "id": "6.5",
      "label": "6.5"
    },
    {
      "id": "6",
      "label": "6"
    },
    {
      "id": "5.5",
      "label": "5.5"
    },
    {
      "id": "5",
      "label": "5"
    },
    {
      "id": "4.5",
      "label": "4.5"
    },
    {
      "id": "4",
      "label": "4"
    },
    {
      "id": "3.5",
      "label": "3.5"
    },
    {
      "id": "3",
      "label": "3"
    },
    {
      "id": "2.5",
      "label": "2.5"
    },
    {
      "id": "2",
      "label": "2"
    },
    {
      "id": "1.5",
      "label": "1.5"
    },
    {
      "id": "1",
      "label": "1"
    }
  ]
}
