{
  "$schema": "../../schema/0.1/vocabulary.schema.json",
  "id": "sheldon-70",
  "title": "Sheldon 70-point numeric grade",
  "description": "The 70-point numismatic grading scale (Sheldon scale) used by major US coin grading services. Pair with 'grader' to say which service assigned it.",
  "license": "CC0-1.0",
  "ordered": true,
  "terms": [
    {
      "id": "70",
      "label": "70"
    },
    {
      "id": "69",
      "label": "69"
    },
    {
      "id": "68",
      "label": "68"
    },
    {
      "id": "67",
      "label": "67"
    },
    {
      "id": "66",
      "label": "66"
    },
    {
      "id": "65",
      "label": "65"
    },
    {
      "id": "64",
      "label": "64"
    },
    {
      "id": "63",
      "label": "63"
    },
    {
      "id": "62",
      "label": "62"
    },
    {
      "id": "61",
      "label": "61"
    },
    {
      "id": "60",
      "label": "60"
    },
    {
      "id": "59",
      "label": "59"
    },
    {
      "id": "58",
      "label": "58"
    },
    {
      "id": "57",
      "label": "57"
    },
    {
      "id": "56",
      "label": "56"
    },
    {
      "id": "55",
      "label": "55"
    },
    {
      "id": "54",
      "label": "54"
    },
    {
      "id": "53",
      "label": "53"
    },
    {
      "id": "52",
      "label": "52"
    },
    {
      "id": "51",
      "label": "51"
    },
    {
      "id": "50",
      "label": "50"
    },
    {
      "id": "49",
      "label": "49"
    },
    {
      "id": "48",
      "label": "48"
    },
    {
      "id": "47",
      "label": "47"
    },
    {
      "id": "46",
      "label": "46"
    },
    {
      "id": "45",
      "label": "45"
    },
    {
      "id": "44",
      "label": "44"
    },
    {
      "id": "43",
      "label": "43"
    },
    {
      "id": "42",
      "label": "42"
    },
    {
      "id": "41",
      "label": "41"
    },
    {
      "id": "40",
      "label": "40"
    },
    {
      "id": "39",
      "label": "39"
    },
    {
      "id": "38",
      "label": "38"
    },
    {
      "id": "37",
      "label": "37"
    },
    {
      "id": "36",
      "label": "36"
    },
    {
      "id": "35",
      "label": "35"
    },
    {
      "id": "34",
      "label": "34"
    },
    {
      "id": "33",
      "label": "33"
    },
    {
      "id": "32",
      "label": "32"
    },
    {
      "id": "31",
      "label": "31"
    },
    {
      "id": "30",
      "label": "30"
    },
    {
      "id": "29",
      "label": "29"
    },
    {
      "id": "28",
      "label": "28"
    },
    {
      "id": "27",
      "label": "27"
    },
    {
      "id": "26",
      "label": "26"
    },
    {
      "id": "25",
      "label": "25"
    },
    {
      "id": "24",
      "label": "24"
    },
    {
      "id": "23",
      "label": "23"
    },
    {
      "id": "22",
      "label": "22"
    },
    {
      "id": "21",
      "label": "21"
    },
    {
      "id": "20",
      "label": "20"
    },
    {
      "id": "19",
      "label": "19"
    },
    {
      "id": "18",
      "label": "18"
    },
    {
      "id": "17",
      "label": "17"
    },
    {
      "id": "16",
      "label": "16"
    },
    {
      "id": "15",
      "label": "15"
    },
    {
      "id": "14",
      "label": "14"
    },
    {
      "id": "13",
      "label": "13"
    },
    {
      "id": "12",
      "label": "12"
    },
    {
      "id": "11",
      "label": "11"
    },
    {
      "id": "10",
      "label": "10"
    },
    {
      "id": "9",
      "label": "9"
    },
    {
      "id": "8",
      "label": "8"
    },
    {
      "id": "7",
      "label": "7"
    },
    {
      "id": "6",
      "label": "6"
    },
    {
      "id": "5",
      "label": "5"
    },
    {
      "id": "4",
      "label": "4"
    },
    {
      "id": "3",
      "label": "3"
    },
    {
      "id": "2",
      "label": "2"
    },
    {
      "id": "1",
      "label": "1"
    }
  ]
}
